{
  "$schema": "https://json-schema.org/draft/2020-12/schema",
  "$id": "https://singleaxis.ai/contracts/capture/v1/run-reconstruction-v1.schema.json",
  "title": "Fabric run reconstruction v1 (draft, spec 042 rev 4)",
  "description": "Output of python -m fabric.reconstruct. An integrity verdict over captured model exchanges for a declared scope, derived from exchange/loss/heartbeat spans and the exact bytes in the customer store. It is not a quality evaluation and carries no content.",
  "type": "object",
  "additionalProperties": false,
  "required": ["schema_version", "generated_at", "verifier", "inputs", "sources", "runs"],
  "properties": {
    "schema_version": {"const": "fabric.run-reconstruction/v1"},
    "generated_at": {"type": "string", "format": "date-time"},
    "verifier": {
      "type": "object",
      "additionalProperties": false,
      "required": ["name", "version"],
      "properties": {
        "name": {"const": "fabric.reconstruct"},
        "version": {"type": "string", "minLength": 1, "maxLength": 64}
      }
    },
    "inputs": {
      "type": "object",
      "additionalProperties": false,
      "required": ["span_files"],
      "properties": {
        "span_files": {
          "type": "array",
          "minItems": 1,
          "items": {
            "type": "object",
            "additionalProperties": false,
            "required": ["path", "sha256", "format", "records"],
            "properties": {
              "path": {"type": "string", "minLength": 1, "maxLength": 4096},
              "sha256": {"$ref": "#/$defs/digest"},
              "format": {"enum": ["sink_jsonl", "otlp_json"]},
              "records": {"type": "integer", "minimum": 0}
            }
          }
        },
        "store": {
          "type": "object",
          "additionalProperties": false,
          "required": ["kind", "tenant_id"],
          "properties": {
            "kind": {"enum": ["local", "s3"]},
            "tenant_id": {"$ref": "#/$defs/opaqueId"}
          }
        }
      }
    },
    "sources": {
      "type": "array",
      "items": {
        "type": "object",
        "additionalProperties": false,
        "required": [
          "source_id", "source_epoch", "exchanges", "heartbeat_sequence",
          "missing_sequences", "loss_ranges"
        ],
        "properties": {
          "source_id": {"$ref": "#/$defs/opaqueId"},
          "source_epoch": {"type": "integer", "minimum": 0},
          "exchanges": {"type": "integer", "minimum": 0},
          "heartbeat_sequence": {"type": "integer", "minimum": -1},
          "missing_sequences": {"type": "array", "items": {"$ref": "#/$defs/range"}},
          "loss_ranges": {
            "type": "array",
            "items": {
              "type": "object",
              "additionalProperties": false,
              "required": ["reason", "first_sequence", "last_sequence", "count"],
              "properties": {
                "reason": {"$ref": "#/$defs/lossReason"},
                "first_sequence": {"type": "integer", "minimum": 0},
                "last_sequence": {"type": "integer", "minimum": 0},
                "count": {"type": "integer", "minimum": 1}
              }
            }
          }
        }
      }
    },
    "runs": {"type": "array", "items": {"$ref": "#/$defs/run"}}
  },
  "$defs": {
    "opaqueId": {
      "type": "string", "minLength": 1, "maxLength": 128,
      "pattern": "^[A-Za-z0-9][A-Za-z0-9._:-]*$"
    },
    "digest": {"type": "string", "pattern": "^sha256:[0-9a-f]{64}$"},
    "range": {
      "type": "array",
      "prefixItems": [
        {"type": "integer", "minimum": 0},
        {"type": "integer", "minimum": 0}
      ],
      "minItems": 2,
      "maxItems": 2
    },
    "lossReason": {"enum": ["queue_full", "internal_error", "shutdown", "span_dropped"]},
    "api": {
      "enum": [
        "openai.chat_completions", "openai.responses", "openai.completions",
        "openai.embeddings", "anthropic.messages"
      ]
    },
    "gapType": {
      "enum": [
        "sequence_gap", "loss", "tail_unverified", "missing_object", "digest_mismatch",
        "truncated", "unparsed_exchange", "prefix_break", "unmatched_tool_call",
        "unresolved_previous_response"
      ]
    },
    "check": {"enum": ["passed", "failed", "skipped", "not_applicable"]},
    "objectCheck": {
      "type": "object",
      "additionalProperties": false,
      "required": ["verification"],
      "properties": {
        "object_id": {"$ref": "#/$defs/opaqueId"},
        "ref": {
          "description": "Where the verifier's configured store resolved object_id. Local to the reader; never taken from a span.",
          "type": "string", "minLength": 1, "maxLength": 2048
        },
        "sha256": {"$ref": "#/$defs/digest"},
        "byte_length": {"type": "integer", "minimum": 0},
        "verification": {"enum": ["verified", "missing", "digest_mismatch", "not_stored", "not_checked"]}
      }
    },
    "exchange": {
      "type": "object",
      "additionalProperties": false,
      "required": [
        "exchange_id", "source_id", "source_epoch", "source_sequence", "api",
        "started_at", "ended_at", "response_state", "parse_status", "thread_id",
        "tool_call_ids_consumed", "tool_call_ids_emitted", "objects"
      ],
      "properties": {
        "exchange_id": {"$ref": "#/$defs/opaqueId"},
        "source_id": {"$ref": "#/$defs/opaqueId"},
        "source_epoch": {"type": "integer", "minimum": 0},
        "source_sequence": {"type": "integer", "minimum": 0},
        "api": {"$ref": "#/$defs/api"},
        "trace_id": {"type": "string", "pattern": "^[0-9a-f]{32}$"},
        "span_id": {"type": "string", "pattern": "^[0-9a-f]{16}$"},
        "started_at": {"type": "string", "format": "date-time"},
        "ended_at": {"type": "string", "format": "date-time"},
        "model": {
          "type": "string", "minLength": 1, "maxLength": 256,
          "pattern": "^[A-Za-z0-9][A-Za-z0-9._:/@+-]*$"
        },
        "response_id": {"$ref": "#/$defs/opaqueId"},
        "previous_response_id": {"$ref": "#/$defs/opaqueId"},
        "response_state": {"enum": ["complete", "closed_early", "error", "abandoned"]},
        "parse_status": {
          "enum": ["ok", "not_json", "undecodable_encoding", "unrecognized_shape", "truncated", "not_checked"]
        },
        "thread_id": {"$ref": "#/$defs/opaqueId"},
        "continues_exchange_id": {"$ref": "#/$defs/opaqueId"},
        "input_message_count": {"type": "integer", "minimum": 0},
        "output_message_count": {"type": "integer", "minimum": 0},
        "tool_call_ids_consumed": {"type": "array", "items": {"$ref": "#/$defs/opaqueId"}},
        "tool_call_ids_emitted": {"type": "array", "items": {"$ref": "#/$defs/opaqueId"}},
        "objects": {
          "type": "object",
          "additionalProperties": false,
          "properties": {
            "request": {"$ref": "#/$defs/objectCheck"},
            "response": {"$ref": "#/$defs/objectCheck"}
          }
        }
      }
    },
    "gap": {
      "type": "object",
      "additionalProperties": false,
      "required": ["gap_type", "effect"],
      "properties": {
        "gap_type": {"$ref": "#/$defs/gapType"},
        "effect": {"enum": ["info", "partial", "unverified"]},
        "exchange_id": {"$ref": "#/$defs/opaqueId"},
        "source_id": {"$ref": "#/$defs/opaqueId"},
        "source_epoch": {"type": "integer", "minimum": 0},
        "first_sequence": {"type": "integer", "minimum": 0},
        "last_sequence": {"type": "integer", "minimum": 0},
        "tool_call_id": {"$ref": "#/$defs/opaqueId"},
        "previous_response_id": {"$ref": "#/$defs/opaqueId"},
        "object_role": {"enum": ["request", "response"]},
        "reason": {"type": "string", "pattern": "^[a-z][a-z0-9_]{0,63}$"}
      },
      "dependentRequired": {
        "first_sequence": ["source_id", "source_epoch", "last_sequence"],
        "last_sequence": ["first_sequence"]
      }
    },
    "window": {
      "type": "object",
      "additionalProperties": false,
      "required": ["source_id", "source_epoch", "first_sequence", "last_sequence", "heartbeat_sequence"],
      "properties": {
        "source_id": {"$ref": "#/$defs/opaqueId"},
        "source_epoch": {"type": "integer", "minimum": 0},
        "first_sequence": {"type": "integer", "minimum": 0},
        "last_sequence": {"type": "integer", "minimum": 0},
        "heartbeat_sequence": {"type": "integer", "minimum": -1}
      }
    },
    "run": {
      "type": "object",
      "additionalProperties": false,
      "required": [
        "run_id", "verdict", "declared_scope", "exchanges", "threads", "gaps", "counts", "checks"
      ],
      "properties": {
        "run_id": {"$ref": "#/$defs/opaqueId"},
        "verdict": {"enum": ["complete_for_declared_scope", "partial", "unverified"]},
        "declared_scope": {
          "type": "object",
          "additionalProperties": false,
          "required": ["windows"],
          "properties": {
            "windows": {"type": "array", "minItems": 1, "items": {"$ref": "#/$defs/window"}}
          }
        },
        "exchanges": {"type": "array", "items": {"$ref": "#/$defs/exchange"}},
        "threads": {
          "type": "array",
          "items": {
            "type": "object",
            "additionalProperties": false,
            "required": ["thread_id", "exchange_ids"],
            "properties": {
              "thread_id": {"$ref": "#/$defs/opaqueId"},
              "exchange_ids": {"type": "array", "minItems": 1, "items": {"$ref": "#/$defs/opaqueId"}}
            }
          }
        },
        "gaps": {"type": "array", "items": {"$ref": "#/$defs/gap"}},
        "counts": {
          "type": "object",
          "additionalProperties": false,
          "required": ["exchanges", "gaps_by_type"],
          "properties": {
            "exchanges": {"type": "integer", "minimum": 0},
            "gaps_by_type": {
              "type": "object",
              "propertyNames": {"$ref": "#/$defs/gapType"},
              "additionalProperties": {"type": "integer", "minimum": 1}
            }
          }
        },
        "checks": {
          "type": "object",
          "additionalProperties": false,
          "required": ["sequence", "loss", "tail", "bytes", "stitching"],
          "properties": {
            "sequence": {"$ref": "#/$defs/check"},
            "loss": {"$ref": "#/$defs/check"},
            "tail": {"$ref": "#/$defs/check"},
            "bytes": {"$ref": "#/$defs/check"},
            "stitching": {"$ref": "#/$defs/check"}
          }
        }
      }
    }
  }
}
